{
    "$schema": "../deity.schema.json",
    "id": "dagon",
    "name": "Дагон",
    "epithet": "Тень в Море (The Shadow in the Sea)",
    "alignment": null,
    "nature": "demon_lord",
    "domains": "уродство, море, морские чудовища",
    "origins": "Одно из древнейших существ Бездны; изначально клинпот (khepate/qlippoth), превратившийся в демонического повелителя — ни один смертный не понимает этого превращения. За это он заслужил неприязнь бывших сородичей. Демон (demon, Chaos), а не дьявол (devil, Law).",
    "description": "Правит в бесконечном океане, покрытом дезориентирующими островами и глубоководными впадинами, заполненными непостижимыми затонувшими городами. Подводит корабли к рифам, кровавыми жертвами вызывает морских чудовищ; маскируется под потерпевших кораблекрушение или портовых грузчиков, чтобы попасть на борт.",
    "appearance": "Массивное существо с нижней частью тела угря, головой, напоминающей глубоководных хищников, и четырьмя бьющимися щупальцами вместо рук.",
    "spheres_of_interest": [
        "уродство",
        "море",
        "морские чудовища"
    ],
    "edicts": [
        "плавать под водой",
        "развивать свою силу",
        "поощрять распространение опасных морских монстров"
    ],
    "anathema": [
        "нарушить данную клятву",
        "поселиться в районе без выхода к морю",
        "поделиться с посторонними секретами Дагона (каждый — тяжкий грех против него)"
    ],
    "follower_alignments": [
        "NE",
        "CE"
    ],
    "realm": {
        "name": "Уготанок (Ugathoyk)",
        "plan": "Бездна (Abyss)"
    },
    "relationships": {
        "allies": [],
        "enemies": [],
        "others": []
    },
    "temples": [],
    "believers": [
        "бодгарды (boggards)",
        "сауагины (sahuagin)",
        "скамы (skum)",
        "болотные гиганты (bog giants)",
        "отчаявшиеся или порочные прибрежные деревни (соблазнённые богатым уловом или экзотическими золотыми украшениями)",
        "часть моряков"
    ],
    "sacred_animal": null,
    "sacred_colors": [],
    "symbol": "глаз осьминога в золотом диске, окружённый древними рунами",
    "devotee_benefits": {
        "divine_attribute": "Сила (Strength) или Телосложение (Constitution)",
        "divine_power": "раняющая (wounding)",
        "divine_skill": "Атлетика (Athletics)",
        "preferred_weapon": "трезубец (trident)",
        "domains": [
            "Изменение (Change)",
            "Разрушение (Destruction)",
            "Вода (Water)",
            "Рвение (Zeal)"
        ],
        "alternate_domains": [],
        "note": null
    },
    "cleric_spells": [
        "Водный толчок (Hydraulic Push) / Закл. 1",
        "Ноги-ласты (Feet to Fins) / Закл. 3",
        "Цепь молний (Chain Lightning) / Закл. 6"
    ],
    "divine_intercession": {
        "summary": null,
        "boons": null,
        "curses": null
    },
    "westcrown": {
        "status": "Поклонение не поощряется и, как прочие не-дьявольские культы, формально не запрещено, но разрешено условно (легко может быть отозвано).",
        "temple_in_city": null,
        "role_in_ap": "Как портовый город Весткроун логически подходит для культа Дагона."
    },
    "source": [
        "Lost Omens: Gods & Magic pg. 76",
        "Lost Omens: Gods & Magic pg. 124–125"
    ]
}
