{
    "$schema": "../deity.schema.json",
    "id": "asmodeus",
    "name": "Асмодей",
    "epithet": "Принц Тьмы (The Prince of Darkness)",
    "alignment": "LE",
    "nature": "devil_lord",
    "domains": "договоры, гордыня, рабство, тирания",
    "origins": "Одни из старейших сущностей мультивселенной; по собственным писаниям Асмодея и «Книге Проклятых» (Book of the Damned) — один из первых богов, убивший своего брата Ихиса ради абсолютного порядка. Владетель тьмы и закона, правитель плана Ада.",
    "description": "Властвует над договорами, гордыней, рабством и тиранией; наслаждается соблазнением смертных встать на путь зла. Поощряет строгую иерархию, где каждый знает своё место, и использует порядок для собственной эгоистичной выгоды. Сильнейшее законно-злое божество региона Внутреннего моря.",
    "appearance": null,
    "spheres_of_interest": [
        "контракты",
        "гордость",
        "рабство",
        "тирания"
    ],
    "edicts": [
        "заключать контракты с выгодой для себя",
        "править тиранией и пытать более слабых",
        "проявлять подхалимство перед теми, кто выше вас"
    ],
    "anathema": [
        "разорвать контракт",
        "освободить раба",
        "оскорблять Асмодея, проявляя милосердие к своим врагам"
    ],
    "follower_alignments": [
        "LE"
    ],
    "realm": {
        "name": "Несс (Ness)",
        "plan": "Ада (Hell)"
    },
    "relationships": {
        "allies": [
            "Абадар (Abadar)"
        ],
        "enemies": [
            "Кайдэн Кайлин (Cayden Cailean)",
            "Иомедаи (Iomedae)",
            "Ирори (Irori)",
            "Ламашту (Lamashtu)",
            "Ровагуг (Rovagug)",
            "Саренрей (Sarenrae)",
            "Шелин (Shelyn)",
            "Бесмара (Besmara)",
            "Бабушка Паучиха (Grandmother Spider)"
        ],
        "others": [
            "Ихис (Ihys) — умерший брат"
        ]
    },
    "temples": [
        "тёмные храмы возле правительственных зданий"
    ],
    "believers": [
        "дьяволопоклонники",
        "юристы",
        "работорговцы",
        "те, кто стремится к власти или дисциплине"
    ],
    "sacred_animal": "змей",
    "sacred_colors": [
        "чёрный",
        "красный"
    ],
    "symbol": "пятилучевая звезда (пентаграмма)",
    "devotee_benefits": {
        "divine_attribute": "любая",
        "divine_power": "раняющая (wounding)",
        "divine_skill": "Обман (Deception)",
        "preferred_weapon": "булава (mace)",
        "domains": [
            "Уверенность (Confidence)",
            "Огонь (Fire)",
            "Хитрость (Trickery)",
            "Тирания (Tyranny)"
        ],
        "alternate_domains": [
            "Долг (Duty)",
            "Глиф (Glyph)"
        ],
        "note": "Персонажи, связывающие себя с Асмодеем божественной характеристикой, на всю вечность связывают свои души с Принцем Тьмы."
    },
    "cleric_spells": [
        "Очаровать (Charm) / Закл. 1",
        "Внушение (Suggestion) / Закл. 4",
        "Обманка (Mislead) / Закл. 6"
    ],
    "divine_intercession": {
        "summary": "Асмодей склонен предлагать дары, чтобы соблазнить тех, кто готов поддаться его гнусным искушениям; его проклятия чаще всего направлены на тех, кто нарушает контракты от его имени или совершает другие личные оскорбления.",
        "boons": {
            "minor": "Довольный вашим талантом к манипуляциям, Асмодей усиливает ваши навыки. Однажды, когда вы проваливаете проверку Дипломатии для значимой или последовательной Просьбы (Request), вы можете сотворить на цель Просьбы Внушение (Suggestion) / Закл. 4, предложив тот же ход действий. Это врождённое сакральное заклинание.",
            "moderate": "Ваши глаза светятся красным, как угольки, а ваша кожа приобретает малиновый оттенок. Вы получаете ночное зрение и сопротивление огню 5.",
            "major": "Асмодей помогает обеспечивать соблюдение ваших сделок и контрактов. Когда существо заключает с вами сделку/контракт без принуждения и по собственной воле, оно не может добровольно нарушить свою сторону, пока вы поддерживаете свою. Вы всегда можете нарушить сделку сами, но тогда существо тоже перестаёт быть обязанным."
        },
        "curses": {
            "minor": "Пламя Асмодея сжигает вас великой злобой. Вы получаете слабость 5 к огню.",
            "moderate": "Асмодей заставляет вас подчиняться. Вы не можете добровольно отказаться от соглашения/контракта или от своего слова, хотя нужно следовать только букве, а не сути.",
            "major": "Асмодей обратил внимание на учинённый вами хаос. Вы получаете древнюю рану (старше самого времени): постоянно истощены 4 (нечто, кроме ещё одного дара, не снимает состояние), и рана ноет при особенно хаотичных поступках, вызывая у вас тошноту 1."
        }
    },
    "westcrown": {
        "status": "Ядро государственной религии Челии: каждый челиец хотя бы формально поклоняется Асмодею, в каждом доме — его алтарь или символ. Дом Трун связан с церковью договором и доктринально её поддерживает.",
        "temple_in_city": "Катада Нессудидия (Qatada Nessudidia), Рего Сасеро; собор Асмодея.",
        "role_in_ap": "В «Совете Воров» церковь Асмодея почти отсутствует и намеренно отодвинута на второй план: Весткроун — «ссыльное» место, отвергнутое и домом Трун, и церковью Асмодея; ресурсы сосредоточены на Эгориане. Без явного запроса церковь наблюдает, но не вмешивается. Условное разрешение (указ королевы Аброгайл II): почитание других богов/дьяволов формально не запрещено, но может быть отозвано в любой момент — что де-факто делает такие культы рискованными."
    },
    "source": [
        "Core Rulebook pg. 437",
        "Lost Omens: Gods & Magic pg. 14",
        "Lost Omens: Gods & Magic pg. 15"
    ]
}
