{
    "$schema": "../deity.schema.json",
    "id": "shelyn",
    "name": "Шелин",
    "epithet": "Вечная Роза (The Eternal Rose)",
    "alignment": "NG",
    "nature": "bov",
    "domains": "искусство, красота, любовь, музыка",
    "origins": "Хочет однажды спасти своего искажённого брата Зон-Кутона (Zon-Kuthon).",
    "description": "Богиня (good, Neutral) искусства, красоты, любви и музыки. Наблюдает за жизнью добрым и любящим взглядом, побуждая смертных делать всё возможное в своей жизни и распространять любовь, искусство и красоту как можно лучше. В её глазах даже самые грубые художественные прозрения достойны похвалы, поскольку представляют собой индивидуальное выражение жизненных испытаний и побед. Она считает, что каждое существо достойно любви и способно по-своему творить искусство. Её религия не требует целомудрия, привязанности или определённой структуры отношений, поскольку страсть раннего романа — аспект любви столь же важный, как комфортное доверие давней супружеской пары; тем не менее она различает ухаживания и чистое плотское желание и предпочитает, чтобы свидания перерастали в более значимые отношения.",
    "appearance": null,
    "spheres_of_interest": [
        "искусство",
        "красота",
        "любовь",
        "музыка"
    ],
    "edicts": [
        "быть миролюбивым",
        "выбирать и совершенствовать искусство",
        "быть примером",
        "видеть красоту во всём"
    ],
    "anathema": [
        "уничтожать искусство или допустить его уничтожение (если только не спасаете жизнь или не стремитесь к большему искусству)",
        "отказаться принимать капитуляцию"
    ],
    "follower_alignments": [
        "LG",
        "NG",
        "CG"
    ],
    "realm": {
        "name": "Цветущее Сердце (Blooming Heart)",
        "plan": "Нирвана (Nirvana)"
    },
    "relationships": {
        "allies": [
            "Абадар (Abadar)",
            "Калистрия (Calistria)",
            "Кайдэн Кайлин (Cayden Cailean)",
            "Дезна (Desna)",
            "Эрастил (Erastil)",
            "Саренрей (Sarenrae)",
            "Брай (Brigh)",
            "Шицуру (Shizuru)"
        ],
        "enemies": [
            "Асмодей (Asmodeus)",
            "Ровагуг (Rovagug)",
            "Ургатоа (Urgathoa)",
            "Зон-Кутон (Zon-Kuthon)"
        ],
        "others": [
            "Дезна (Desna) — возлюбленный",
            "Саренрей (Sarenrae) — возлюбленный",
            "Зон-Кутон (Zon-Kuthon) — брат"
        ]
    },
    "temples": [
        "художественные галереи",
        "соборы",
        "сады",
        "музеи",
        "театры"
    ],
    "believers": [
        "артисты",
        "любовники",
        "менестрели",
        "музыканты",
        "ищущие искупления"
    ],
    "sacred_animal": "певчая птица (songbird)",
    "sacred_colors": [
        "все"
    ],
    "symbol": null,
    "devotee_benefits": {
        "divine_attribute": "Мудрость (Wisdom) или Харизма (Charisma)",
        "divine_power": "исцеляющая (healing)",
        "divine_skill": "Ремесло (Craft) или Выступление (Performance)",
        "preferred_weapon": "глефа (glaive)",
        "domains": [
            "Творчество (Creation)",
            "Семья (Family)",
            "Страсть (Passion)",
            "Защита (Protection)"
        ],
        "alternate_domains": [
            "Покой (Repose)"
        ],
        "note": null
    },
    "cleric_spells": [
        "Цветные брызги (Color Spray) / Закл. 1",
        "Захватывающая речь (Enthrall) / Закл. 3",
        "Созидание (Creation) / Закл. 4"
    ],
    "divine_intercession": {
        "summary": "Когда существа совершают приятные поступки (распространение красоты) или неприятные действия (предательство близких), Шелин может отреагировать соответствующим образом.",
        "boons": {
            "minor": "Однажды, когда вы при броске проверки Дипломатии получаете провал, то вместо этого получаете крит.успех. Шелин обычно награждает этим даром только тогда, когда проверка Дипломатии служит усилению любви или даёт шанс на искупление.",
            "moderate": "Вы вдохновлены на создание великих произведений и становитесь виртуозом во всех видах искусства. Вы получаете способности Специализация в ремесле (Specialty Crafting) / 1 и Виртуозный исполнитель (Virtuosic Performer) / 1 во всех категориях Ремесла и Выступления.",
            "major": "Ваша внутренняя красота и любовь окружают вас аурой. Пока вы не несёте им зла, все существа, кроме бесов, нежити и неразумных, имеют к вам дружественное начальное отношение (если только они не были сразу любезными). Это не значит, что они должны менять жизнь или планы ради вас, и дар не предотвращает ухудшение отношения, если вы им препятствуете. Эффект не работает на божеств и подобных могущественных существ. Дополнительно: любовь, которой вы делитесь с друзьями, вдохновляет их — вы и все союзники получаете бонус состояния +3 к спасброскам и проверкам навыков, пока видите друг друга."
        },
        "curses": {
            "minor": "Ваше сердце сжимается от раскаяния. Каждый день вы испытываете тошноту 1, потому что какой-то конкретный проступок снова и снова проигрывается в вашем сознании в виде чувства вины. Состояние нельзя снять, хотя оно утихает достаточно, чтобы быстро есть и пить, когда необходимо. Если вы загладите вину или иным образом искренне стремитесь искупить проступок, тошнота полностью исчезнет в тот же день.",
            "moderate": "Другие подсознательно признают ваши прошлые предательства. Каждый раз, когда вы при броске Дипломатии получаете провал, то вместо этого получаете крит.провал, а если получаете крит.успех, то получаете просто успех.",
            "major": "Те, кто сеют страдания с помощью ложной любви, сталкиваются с величайшим проклятием Шелин. Вы теряете способность отличать одно живое существо от другого по внешнему виду, голосу, запаху или подобным сенсорным средствам. Вы можете определить физический размер (поэтому не спутаете муравья с лошадью), но не более. Если вы были поверхностны, каждое существо, которое вы видите, имеет общие, мягкие черты; если ваши поступки были гнусными — вы видите только лица тех, кого обидели."
        }
    },
    "westcrown": {
        "status": "Враждебна Асмодею; почитание в Челии формально не запрещено, но не поощряется и легко может быть отозвано (условное разрешение).",
        "temple_in_city": null,
        "role_in_ap": "Её культура (искусство, любовь, музыка) — фоновый контраст к тирании Асмодея"
    },
    "source": [
        "Core Rulebook pg. 440",
        "Lost Omens: Gods & Magic pg. 44",
        "Lost Omens: Gods & Magic pg. 45"
    ]
}
