{
    "$schema": "../deity.schema.json",
    "id": "sifkesh",
    "name": "Сифкеш",
    "epithet": "Прошептанное Сомнение (The Whispered Doubt)",
    "alignment": null,
    "nature": "demon_lord",
    "domains": "самоубийство, отчаяние, сомнения",
    "origins": "Многие верят, что изначально Сифкеш была эринией (erinny), ставшей первым еретиком Ада (the first heretic of Hell).",
    "description": "Демон-лорд (demon, Chaos) самоубийства, отчаяния и сомнений. Не стремится просто уничтожать плоть и разрушать окружение, а вместо этого отравляет умы, искушая верующих предать свою религию богохульствами, наносящим длительный ущерб репутации их религии и обществу. Больше всего удовольствия ей доставляет почти павший жрец, понимающий, что он натворил, и добровольно расстающийся с жизнью, — тогда Сифкеш подхватывает душу еретика и пожирает её. Она воплощает роли всех трёх основных бесовских народов: совращает как дьявол, питается как демон, но по факту является демоном — что долгое время было головоломкой для учёных, пытавшихся классифицировать её демоническую природу.",
    "appearance": "По 1e: человеческая женщина с белоснежными птичьими крыльями и тонкими чёрными волосами, сочащимися кровью; губы и глаза зашиты ржавой проволокой, тело разрезано на куски (обычно в местах бедренных и плечевых суставов, но могут быть и другие); каждая часть тела парит независимо, двигаясь не совсем синхронно с остальными. Актуальное для 2e описание на данный момент отсутствует.",
    "spheres_of_interest": [
        "самоубийство",
        "отчаяние",
        "сомнения"
    ],
    "edicts": [
        "сеять сомнения среди верующих",
        "рушить репутацию религий",
        "склонять правонарушителей к самоубийству вместо того, чтобы позволять искупление"
    ],
    "anathema": [
        "давать надежду",
        "предлагать прощение",
        "искренне чтить или взывать к другому богу"
    ],
    "follower_alignments": [
        "NE",
        "CE"
    ],
    "realm": {
        "name": "Вантиан (Vanthan)",
        "plan": "Бездна (Abyss)"
    },
    "relationships": {
        "allies": [],
        "enemies": [],
        "others": []
    },
    "temples": [],
    "believers": [],
    "sacred_animal": null,
    "sacred_colors": [],
    "symbol": null,
    "devotee_benefits": {
        "divine_attribute": "Мудрость (Wisdom) или Харизма (Charisma)",
        "divine_power": "раняющая (wounding)",
        "divine_skill": "Обман (Deception)",
        "preferred_weapon": "боевая бритва (battle knife)",
        "domains": [
            "Кошмары (Nightmares)",
            "Боль (Pain)",
            "Скорбь (Sorrow)",
            "Хитрость (Trickery)"
        ],
        "alternate_domains": [],
        "note": null
    },
    "cleric_spells": [
        "Дурная примета (Ill Omen) / Закл. 1",
        "Сокрушительное отчаяние (Crushing Despair) / Закл. 5",
        "Подсознательное внушение (Subconscious Suggestion) / Закл. 5"
    ],
    "divine_intercession": {
        "summary": null,
        "boons": null,
        "curses": null
    },
    "westcrown": {
        "status": "Исторический фон: культ не поощряется (условное разрешение, легко отозвать).",
        "temple_in_city": null,
        "role_in_ap": "Исторический фон. В 4573 AR культ Сифкеша, называвший себя «Путь Благодати» (Path of Grace), устроил «Белую Чуму» (White Plague) — массовые убийства и самоубийства; жертв толкали к самоуничтожению. На культ был создан Орден Дыбы (Order of the Rack) — один из орденов Адских рыцарей (Hellknights). Белая Чума — часть травматической памяти Весткроуна, но текущая угроза AP исходит от Совета, Тирана (Tyrant) и адских сил, а не от прямого возвращения Сифкеша."
    },
    "source": [
        "Lost Omens: Gods & Magic pg. 126–127",
        "Book of the Damned pg. 93"
    ]
}
